"","link","Type.de.notice","Type.de.document","Titre","Auteur","Contributeur","Editeur","Date","Description","Sujet","Langue","Format","pages","link_gallica"
"401","http://catalogue.bnf.fr/ark:/12148/cb30495660n","monographie","texte imprimé","Leçons d'une gouvernante à ses élèves, ou Fragmens d'un journal, qui a été fait pour l'éducation des enfans de Monsieur d'Orléans . Par madame de Sillery-Brulart, gouvernante de M.elle d'Orléans. Tome premier. [-Tome second]","Genlis, Stéphanie-Félicité Du Crest comtesse de (1746-1830). Auteur du texte","","A Paris, chez Onfroy, libraire, rue S. Victor, n.° 113, Née de la Rochelle, libraire, rue du Hurepoix, n.° 13. 1791.","1791","","","fre | français | ","2 vol. (371, 12-582 p.) ; in-12","2 vol. (371, 12-582 p.","https://gallica.bnf.fr/ark:/12148/bpt6k97703630 | https://gallica.bnf.fr/ark:/12148/bpt6k97699373"
"402","http://catalogue.bnf.fr/ark:/12148/cb304955982","monographie","texte imprimé","Théâtre à l'usage des jeunes personnes. Tome premier. [-quatrième.]","Genlis, Stéphanie-Félicité Du Crest comtesse de (1746-1830). Auteur du texte","","A Paris, Chez Panckoucke. M. DCC. LXXIX. [- A Paris, Chez M. Lambert & F.J. Baudouin. M. DCC. LXXX.]","1779-1780","","","fre | français | ","4 vol. (522, [2] ; [4], 463, [1] ; [4], 435, [1] ; [4], 411, [1] p. )̊ ; in-8","4 vol. (522, [2] ; [4], 463, [1] ; [4], 435, [1] ; [4], 411, [1] p.","https://gallica.bnf.fr/ark:/12148/bpt6k1512359x | https://gallica.bnf.fr/ark:/12148/bpt6k15122036 | https://gallica.bnf.fr/ark:/12148/bpt6k1512201c | https://gallica.bnf.fr/ark:/12148/bpt6k15123610"
"403","http://catalogue.bnf.fr/ark:/12148/cb30495396t","monographie","texte imprimé","Les veillées du château, ou Cours de morale à l'usage des enfants , par l'auteur d'Adèle et Théodore","Genlis, Stéphanie-Félicité Du Crest comtesse de (1746-1830). Auteur du texte","","impr. de Lambert et Baudouin (Paris)","1784","","Éducation morale","fre | français | ","3 vol. (XV-555, 587, 408-[IV] p.) ; in-8","3 vol. (XV-555, 587, 408-[IV] p.","https://gallica.bnf.fr/ark:/12148/bpt6k6272524c | https://gallica.bnf.fr/ark:/12148/bpt6k62607816 | https://gallica.bnf.fr/ark:/12148/bpt6k62752211"
"404","http://catalogue.bnf.fr/ark:/12148/cb30495670z","monographie","texte imprimé","Mémoires inédits de Madame la comtesse de Genlis, sur le dix-huitième siècle et la Révolution française, depuis 1756 jusqu'à nos jours","Genlis, Stéphanie-Félicité Du Crest comtesse de (1746-1830). Auteur du texte","","Ladvocat (Paris)","1825","Comprend : 1.- [16]-XIX-399 p. ; 2.- XX-380 p. ; 3.- XXIII-374 p. ; 4-10","","fre | français | ","10 vol. : portraits ; in-8",NA,"https://gallica.bnf.fr/ark:/12148/bpt6k480231r | https://gallica.bnf.fr/ark:/12148/bpt6k4802324 | https://gallica.bnf.fr/ark:/12148/bpt6k480233h | https://gallica.bnf.fr/ark:/12148/bpt6k480234w | https://gallica.bnf.fr/ark:/12148/bpt6k4802358 | https://gallica.bnf.fr/ark:/12148/bpt6k480236n | https://gallica.bnf.fr/ark:/12148/bpt6k4802371 | https://gallica.bnf.fr/ark:/12148/bpt6k480238d | https://gallica.bnf.fr/ark:/12148/bpt6k480239s | https://gallica.bnf.fr/ark:/12148/bpt6k480240q"
"405","http://catalogue.bnf.fr/ark:/12148/cb41343060j","monographie","texte imprimé","Les chevaliers du Cygne, ou La cour de Charlemagne ; conte historique et moral, pour servir de suite aux Veillées du château, et dont tous les traits qui peuvent faire allusion à la révolution française, sont tirés de l'histoire. Par Madame de Genlis. Tome premier [-troisième]","Genlis, Stéphanie-Félicité Du Crest comtesse de (1746-1830). Auteur du texte","","A Hambourg, chez P. F. Fauche, imprimeur et libraire. 1797","1797","","","fre | français | ","3 vol. (XXIV-347 p., front. ; VI-364 p., front. ; VI-376 p., front.) ; in-12","3 vol. (XXIV-347 p.","https://gallica.bnf.fr/ark:/12148/bpt6k1511942d | https://gallica.bnf.fr/ark:/12148/bpt6k15119447 | https://gallica.bnf.fr/ark:/12148/bpt6k15119462"
"406","http://catalogue.bnf.fr/ark:/12148/cb30495524h","monographie","texte imprimé","Les Chevaliers du cygne, ou La cour de Charlemagne , contes pour servir de suite aux Veillées du château, et dont tous les traits qui peuvent faire allusion à la Révolution française sont tirés de l'histoire. Par madame de Genlis","Genlis, Stéphanie-Félicité Du Crest comtesse de (1746-1830). Auteur du texte","","Lemierre (Paris) | P. F. Fauche (Hambourg) | ","1795","","","fre | français | ","3 vol. (XXIV-381, 406, 434 p.) ; in-8","3 vol. (XXIV-381, 406, 434 p.","https://gallica.bnf.fr/ark:/12148/bd6t5381050h | https://gallica.bnf.fr/ark:/12148/bd6t5381095s | https://gallica.bnf.fr/ark:/12148/bd6t5380989g"
"407","http://catalogue.bnf.fr/ark:/12148/cb39307475t","monographie","texte imprimé","La religion considérée comme l'unique base du bonheur et de la véritable philosophie . Ouvrage fait pour servir à l'éducation des enfans de S. A. S. monseigneur le duc d'Orléans, & dans lequel on expose & l'on réfute les principes des prétendus philosophes modernes. Par madame la marquise de Sillery, ci-devant madame la comtesse de Genlis. Nouvelle edition, revue, augmentée & corrigée","Genlis, Stéphanie-Félicité Du Crest comtesse de (1746-1830). Auteur du texte","","A Orléans, de l'imprimerie de Couret de Villeneuve, imp. du Roi & de S. A. S. Mgr. le duc d'Orléans. Et se trouve à Paris, chez Cuchet, libraire, rue & hôtel Serpente. M. DCC. LXXXVII. Avec approbation & privilége du Roi","1787","","","fre | français | ","[4]-VIII-353-[1 bl.]-XCVI-[4] p. ; in-12","4]-VIII-353-[1 bl.]-XCVI-[4] p.","https://gallica.bnf.fr/ark:/12148/bd6t53865963"
"408","http://catalogue.bnf.fr/ark:/12148/cb304954336","monographie","texte imprimé","Six nouvelles morales et religieuses / par madame la comtesse de Genlis,...","Genlis, Stéphanie-Félicité Du Crest comtesse de (1746-1830). Auteur du texte","","L. Janet (Paris) | M. Bossange (Londres) | ","175.-18..","","","fre | français | ","VIII-316 p.-[5] p. de pl. : pl. et titre gravés ; 17 cm","316 p.","https://gallica.bnf.fr/ark:/12148/bpt6k1518756x"
"409","http://catalogue.bnf.fr/ark:/12148/cb30495672n","monographie","texte imprimé","Mémoires de Mme de Genlis... / avec avant-propos et notes, par M. Fs. Barrière","Genlis, Stéphanie-Félicité Du Crest comtesse de (1746-1830). Auteur du texte","Barrière, François (1786-1868). Éditeur scientifique","Firmin-Didot frères, fils et Cie (Paris)","1857","Collection : Bibliothèque des mémoires relatifs à l'histoire de France pendant le 18e et le 19e siècle ; 15","","fre | français | ","XVIII-451 p. ; in-16","451 p.","https://gallica.bnf.fr/ark:/12148/bpt6k62275961"
"410","http://catalogue.bnf.fr/ark:/12148/cb321561833","monographie","texte imprimé","Contes moraux de Mme de Genlis / illustrés de 40 gravures par Foulquier","Genlis, Stéphanie-Félicité Du Crest comtesse de (1746-1830). Auteur du texte","Foulquier, Valentin (1822-1896). Illustrateur","Hachette (Paris)","1886","","","fre | français | ","1 vol. (VII-287-26 p.) : ill. ; in-16","1 vol. (VII-287-26 p.","https://gallica.bnf.fr/ark:/12148/bpt6k55990348"
"411","http://catalogue.bnf.fr/ark:/12148/cb304954963","monographie","texte imprimé","Lettres inédites de Mme de Genlis à son fils adoptif Casimir Baecker (1802-1830) / publ. avec une introd. et des notes, d'après des documents nouveaux, par Henry Lapauze","Genlis, Stéphanie-Félicité Du Crest comtesse de (1746-1830). Auteur du texte","Lapauze, Henry (1867-1925). Éditeur scientifique. Préfacier","Plon-Nourrit (Paris)","1902","","Baecker, Casimir (1790-1864)","fre | français | ","XLVII-364 p. : fac-sim. ; in-8","364 p.","https://gallica.bnf.fr/ark:/12148/bpt6k2063983"
"412","http://catalogue.bnf.fr/ark:/12148/cb304954994","monographie","texte imprimé","Adèle et Théodore, ou Lettres sur l'éducation ; contenant tous les principes relatifs aux trois différens plans d'éducation des princes, des jeunes personnes, & des hommes. Tome premier [-troisième]","Genlis, Stéphanie-Félicité Du Crest comtesse de (1746-1830). Auteur du texte","","A Paris, chez M. Lambert & F.J. Baudouin. M.DCC.LXXXII","1782","","","fre | français | ","3 vol. (519, 491, 536 p.) ; in-12","3 vol. (519, 491, 536 p.","https://gallica.bnf.fr/ark:/12148/bpt6k5478136b | https://gallica.bnf.fr/ark:/12148/bpt6k54791179 | https://gallica.bnf.fr/ark:/12148/bpt6k5471501b"
"413","http://catalogue.bnf.fr/ark:/12148/cb30495482d","monographie","texte imprimé","D. Inez de Castro : novela / pela condeça de Genlis ; traduzida do francez pelo Dr Caetano Lopes de Moura,...","Genlis, Stéphanie-Félicité Du Crest comtesse de (1746-1830). Auteur du texte","Lopes de Moura, Caetano (1780-1860). Traducteur","Va J.-P. Aillaud, Monlon e Ca (Pariz)","1855","","","por | portugais | ","1 vol. (243 p.) : fig. ; in-12","1 vol. (243 p.","https://gallica.bnf.fr/ark:/12148/bpt6k9307060"
"414","http://catalogue.bnf.fr/ark:/12148/cb304956730","monographie","texte imprimé","Mémoires de Mme de Genlis sur la cour, la ville et les salons de Paris / [Mme de Genlis] ; ill. par Janet-Lange et V. Foulquier,... ; publiés avec le concours de Mme Georgette Ducrest","Genlis, Stéphanie-Félicité Du Crest comtesse de (1746-1830). Auteur du texte","Janet-Lange (1815-1872). Illustrateur | Ducrest, Georgette. Éditeur scientifique | ","G. Barba (Paris)","1868","Collection : Panthéon populaire illustré","","fre | français | ","160 p. : fig. ; in-4°","160 p.","https://gallica.bnf.fr/ark:/12148/bpt6k6117064t"
"415","http://catalogue.bnf.fr/ark:/12148/cb41649688j","monographie","texte imprimé","Précis de la conduite de Madame de Genlis depuis la Révolution . Suivi d'une Lettre à M. de Chartres, et de Réflexions sur la critique","Genlis, Stéphanie-Félicité Du Crest comtesse de (1746-1830). Auteur du texte","","A Hambourg, et se trouve à Paris, chez Cerioux, quai de Voltaire, n° 9 [1796]","1796","","","fre | français | ","335 p. ; in-12","335 p.","https://gallica.bnf.fr/ark:/12148/bpt6k15186162"
"416","http://catalogue.bnf.fr/ark:/12148/cb30495674b","monographie","texte imprimé","Mémoires de Mme de Genlis sur la cour, la ville et les salons de Paris / illustrés par Janet-Lange et V. Foulquier ; publiés avec le concours de Mme Georgette Ducrest","Genlis, Stéphanie-Félicité Du Crest comtesse de (1746-1830). Auteur du texte","Janet-Lange (1815-1872). Illustrateur | Foulquier, Valentin (1822-1896). Illustrateur | Ducrest, Georgette. Éditeur scientifique | ","G. Barba (Paris)","","Collection : Panthéon populaire illustré ; n° 70","","fre | français | ","1 vol. (160 p.) : fig. ; gr. in-8","1 vol. (160 p.","https://gallica.bnf.fr/ark:/12148/bpt6k6183667t"
"417","http://catalogue.bnf.fr/ark:/12148/cb305269415","monographie","texte imprimé","L'Esprit françois, ou Problème à résoudre sur le labyrinthe des divers complots , par Mme de Gouges","Gouges, Olympe de (1748-1793). Auteur du texte","","Vve Duchesne (Paris)","1792","","France (1774-1792, Louis XVI)","fre | français | ","In-8, VIII-32 p.","8, VIII-32 p.","https://gallica.bnf.fr/ark:/12148/bpt6k96196932"
"418","http://catalogue.bnf.fr/ark:/12148/cb305269535","monographie","texte imprimé","Mirabeau aux Champs-Élisées . Comédie en un acte et en prose, par madame de Gouges...","Gouges, Olympe de (1748-1793). Auteur du texte","","Garnéry (Paris)","1790-1795","","","fre | français | ","XXI-[ bl.]-46 p. ; in-8","46 p.","https://gallica.bnf.fr/ark:/12148/bpt6k9808815f"
"419","http://catalogue.bnf.fr/ark:/12148/cb30526940t","monographie","texte imprimé","L'esclavage des noirs, ou L'heureux naufrage , drame en trois actes, en prose,... par Mme de Gouges,...","Gouges, Olympe de (1748-1793). Auteur du texte","","Vve Duchesne (Paris) | Vve Bailly (Paris) | chez les marchands de nouveauté (Paris) | ","1792","","","fre | français | ","50 p. ; in-8","50 p.","https://gallica.bnf.fr/ark:/12148/bpt6k57456272"
"420","http://catalogue.bnf.fr/ark:/12148/cb30526951g","monographie","texte imprimé","Le Mariage inattendu de Chérubin, comédie en 3 actes et en prose / par Mme de Gouge","Gouges, Olympe de (1748-1793). Auteur du texte","","Cailleau (Séville)","1788","","","fre | français | ","111 p. ; in-8°","111 p.","https://gallica.bnf.fr/ark:/12148/bpt6k6505255m"
"421","http://catalogue.bnf.fr/ark:/12148/cb33453467m","monographie","texte imprimé","Lettre au peuple, ou Projet d'une caisse patriotique ; par une citoyenne","Gouges, Olympe de (1748-1793). Auteur du texte","","A Vienne, et se trouve à Paris, chez les marchands de nouveautés. 1788","1788","","France (1774-1792, Louis XVI)","fre | français | ","31 p., front. ; in-8","31 p.","https://gallica.bnf.fr/ark:/12148/bd6t5373198j"
"422","http://catalogue.bnf.fr/ark:/12148/cb30526939m","monographie","texte imprimé","L'entrée de Dumourier à Bruxelles, ou Les vivandiers , pièce en cinq actes et en prose, par Olympe de Gouges, représentée sur le Théâtre de la République, rue de Richelieu, le janvier 1793, l'an deuxième de la République","Gouges, Olympe de (1748-1793). Auteur du texte","","Regnaud (Paris)","1793","","","fre | français | ","148 p. ; in-8","148 p.","https://gallica.bnf.fr/ark:/12148/bpt6k9602961p"
"423","http://catalogue.bnf.fr/ark:/12148/cb30526961s","monographie","texte imprimé","Remarques patriotiques , par la citoyenne, auteur de la Lettre au peuple","Gouges, Olympe de (1748-1793). Auteur du texte","","[s.n.]","1780-1800","","France (1774-1792, Louis XVI)","fre | français | ","48 p.-1 p. de pl. ; in-8","48 p.","https://gallica.bnf.fr/ark:/12148/bpt6k96226223"
"424","http://catalogue.bnf.fr/ark:/12148/cb30526933j","monographie","texte imprimé","Le couvent, ou Les voeux forcés , drame en trois actes. Représenté en deux actes, & remis en trois au Théâtre françois, comique & lyrique, au mois d'octobre 1790...","Gouges, Olympe de (1748-1793). Auteur du texte","","Vve Duchesne (Paris)","1792","","","fre | français | ","83 p. ; in-8","83 p.","https://gallica.bnf.fr/ark:/12148/bpt6k98191376"
"425","http://catalogue.bnf.fr/ark:/12148/cb305269206","monographie","texte imprimé","Oeuvres de madame de Gouges.... Tome premier","Gouges, Olympe de (1748-1793). Auteur du texte","","chez l'auteur (Paris) | chez Cailleau (Paris) | ","1788","Comprend : Mémoire de madame de Valmont . - A Paris : chez l'auteur : chez Cailleau, 1788 ; L'Homme généreux, drame en cinq actes et en prose . - A Paris : chez l'auteur : chez Knapen et fils, 1786 ; Le Mariage inattendu de Chérubin, comédie en trois actes et en prose . - A Séville : chez Cailleau, 1786","","fre | français | ","160-140-111 p. ; in-8°","160-140-111 p.","https://gallica.bnf.fr/ark:/12148/bpt6k6546469r"
"426","http://catalogue.bnf.fr/ark:/12148/cb36057180p","monographie","texte imprimé","Les droits de la femme . A la Reine","Gouges, Olympe de (1748-1793). Auteur du texte","Marie-Antoinette (1755-1793 ; reine de France). Dédicataire","[Paris, 1791]","1791","","France (1774-1792, Louis XVI)","fre | français | ","24 p. ; in-8","24 p.","https://gallica.bnf.fr/ark:/12148/bpt6k64848397 | https://gallica.bnf.fr/ark:/12148/bpt6k9629179b | https://gallica.bnf.fr/ark:/12148/bpt6k317906t"
"427","http://catalogue.bnf.fr/ark:/12148/cb307200062","monographie","texte imprimé","Tangu et Félime ou le Pied de nez, poème en quatre chants, par La Harpe","La Harpe, Jean François de (1739-1803). Auteur du texte","","P. Villiers (Paris)","1824","","","fre | français | ","In-12, 70 p. et pl.","12, 70 p.","https://gallica.bnf.fr/ark:/12148/bpt6k3753645"
"428","http://catalogue.bnf.fr/ark:/12148/cb30719992x","monographie","texte imprimé","L'Homme de lettres , épître à Monsieur ***","La Harpe, Jean François de (1739-1803). Auteur du texte","","","","","","fre | français | ","In-8, 7 p.","8, 7 p.","https://gallica.bnf.fr/ark:/12148/bpt6k5425965h"
"429","http://catalogue.bnf.fr/ark:/12148/cb30719995z","monographie","texte imprimé","Montézume à Cortez ; Élisabeth de France à Don Carlos ; héroïdes nouvelles, par M. de La Harpe,...","La Harpe, Jean François de (1739-1803). Auteur du texte","","Cailleau (Paris)","1764","","","fre | français | ","In-8° , 30 p.","8° , 30 p.","https://gallica.bnf.fr/ark:/12148/bpt6k5426951s"
"430","http://catalogue.bnf.fr/ark:/12148/cb307200031","monographie","texte imprimé","Des Talens dans leurs rapports avec la société et le bonheur, pièce qui a remporté le prix de l'Académie françoise en 1771, par M. de La Harpe","La Harpe, Jean François de (1739-1803). Auteur du texte","","Vve Regnard (Paris)","1871","","","fre | français | ","In-8° , 11 p.","8° , 11 p.","https://gallica.bnf.fr/ark:/12148/bpt6k54275665"
"431","http://catalogue.bnf.fr/ark:/12148/cb307200093","monographie","texte imprimé","Vers à S. M. Louis XVI, sur l'édit du 31 mai, par M. de La Harpe","La Harpe, Jean François de (1739-1803). Auteur du texte","","Morin (Paris)","1774","","","fre | français | ","In-8° , 7 p.","8° , 7 p.","https://gallica.bnf.fr/ark:/12148/bpt6k5426000c"
"432","http://catalogue.bnf.fr/ark:/12148/cb37239189b","monographie","texte imprimé","Mélanie ou La religieuse : drame en trois actes et en vers ([Reprod.]) par M. de La Harpe","La Harpe, Jean François de (1739-1803). Auteur du texte","","Maxwell","1792","Collection : Les archives de la Révolution française ; 12.215","","fre | français | ","1 microfiche ; 105*148 mm","microfiche","https://gallica.bnf.fr/ark:/12148/bpt6k482902"
"433","http://catalogue.bnf.fr/ark:/12148/cb372391927","monographie","texte imprimé","Virginie : tragédie en cinq actes et en vers ([Reprod.]) par le citoyen La Harpe, de l'Académie française","La Harpe, Jean François de (1739-1803). Auteur du texte","","Maxwell","1793","Collection : Les archives de la Révolution française ; 12.216","","fre | français | ","1 microfiche ; 105*148 mm","microfiche","https://gallica.bnf.fr/ark:/12148/bpt6k48291d"
"434","http://catalogue.bnf.fr/ark:/12148/cb372462831","monographie","texte imprimé","Réponse aux observations pour les comédiens français ([Reprod.]) [signé : de La Harpe, Champfort, Sedaine... [et al.]","La Harpe, Jean François de (1739-1803). Auteur du texte","","Micro Graphix","179.","Collection : Les archives de la Révolution française ; 12.67","","fre | français | ","1 microfiche ; 105*148 mm","microfiche","https://gallica.bnf.fr/ark:/12148/bpt6k570220"
"435","http://catalogue.bnf.fr/ark:/12148/cb372364434","monographie","texte imprimé","Adresse des auteurs dramatiques à l'Assemblée nationale prononcée par M. de La Harpe, dans la séance du mardi soir 24 août ([Reprod.]) ","La Harpe, Jean François de (1739-1803). Auteur du texte","","Maxwell","1795","Collection : Les archives de la Révolution française ; 12.65","","fre | français | ","1 microfiche ; 105*148 mm","microfiche","https://gallica.bnf.fr/ark:/12148/bpt6k48166x"
"436","http://catalogue.bnf.fr/ark:/12148/cb307199740","monographie","texte imprimé","Éloge de La Fontaine, qui a concouru pour le prix de l'Académie de Marseille, en 1774 . Par M. de La Harpe.","La Harpe, Jean François de (1739-1803). Auteur du texte","","Lacombe (Paris)","1774","","La Fontaine, Jean de","fre | français | ","62 p. ; in-8","62 p.","https://gallica.bnf.fr/ark:/12148/bpt6k5613129g"
"437","http://catalogue.bnf.fr/ark:/12148/cb30719985n","monographie","texte imprimé","Caton à César et Annibal à Flaminius , héroïdes, par l'auteur de Montézume","La Harpe, Jean François de (1739-1803). Auteur du texte","","[s.n.] (Paris)","1760","","","fre | français | ","14 p. ; in-8","14 p.","https://gallica.bnf.fr/ark:/12148/bpt6k54291561"
"438","http://catalogue.bnf.fr/ark:/12148/cb30719988p","monographie","texte imprimé","Conseils à un jeune poète, pièce qui a remporté le prix de l'Académie françoise, en 1775, par M. de La Harpe","La Harpe, Jean François de (1739-1803). Auteur du texte","","Demonville (Paris)","1775","","","fre | français | ","In-8° , 16 p.","8° , 16 p.","https://gallica.bnf.fr/ark:/12148/bpt6k54273548"
"439","http://catalogue.bnf.fr/ark:/12148/cb323393076","monographie","texte imprimé","Sections de Paris, prenez-y garde. Discours prononcé dans la Section de la Butte des Moulins [par Laharpe]","La Harpe, Jean François de (1739-1803). Auteur du texte","","","","","","fre | français | ","",NA,"https://gallica.bnf.fr/ark:/12148/bpt6k6459556f"
"440","http://catalogue.bnf.fr/ark:/12148/cb30720011n","monographie","texte imprimé","Théâtre de La Harpe. Édition Touquet","La Harpe, Jean François de (1739-1803). Auteur du texte","","Touquet (Paris)","1821","Comprend : Warwick, Philoctète, Coriolan, Virginie, Mélanie","","fre | français | ","1 vol. (245 p.) ; in-12","1 vol. (245 p.","https://gallica.bnf.fr/ark:/12148/bpt6k9754449r"
"441","http://catalogue.bnf.fr/ark:/12148/cb30720075w","monographie","texte imprimé","La Liberté de la presse défendue, par La Harpe, contre Chénier","La Harpe, Jean François de (1739-1803). Auteur du texte","","Migneret (Paris)","1794","","France (1792-1795)","fre | français | ","In-8° , 22 p.","8° , 22 p.","https://gallica.bnf.fr/ark:/12148/bpt6k132331s"
"442","http://catalogue.bnf.fr/ark:/12148/cb30720077k","monographie","texte imprimé","Philosophie du dix-huitième siècle . Ouvrage posthume de J.-F. Laharpe. Nouvelle édition","La Harpe, Jean François de (1739-1803). Auteur du texte","","V. Lagier (Dijon) | Frantin (Dijon) | ","1821","","","fre | français | ","2 vol. ; in-12",NA,"https://gallica.bnf.fr/ark:/12148/bpt6k3043741z"
"443","http://catalogue.bnf.fr/ark:/12148/cb30720001b","monographie","texte imprimé","Le Poëte, épître qui a remporté le prix de l'Académie françoise en 1766, par M. de La Harpe","La Harpe, Jean François de (1739-1803). Auteur du texte","","impr. de Regnard (Paris)","1766","","","fre | français | ","In-8° , 15 p.","8° , 15 p.","https://gallica.bnf.fr/ark:/12148/bpt6k5436831z"
"444","http://catalogue.bnf.fr/ark:/12148/cb30719997n","monographie","texte imprimé","La navigation . Ode qui a remporté le prix de l'Académie françoise, en 1773. Par M. de La Harpe","La Harpe, Jean François de (1739-1803). Auteur du texte","","J.-B. Brunet (Paris)","1773","","","fre | français | ","14 p. ; in-8","14 p.","https://gallica.bnf.fr/ark:/12148/bpt6k5507379s"
"445","http://catalogue.bnf.fr/ark:/12148/cb30720005q","monographie","texte imprimé","Tangu et Félime , poëme en IV chant par M. de La Harpe,...","La Harpe, Jean François de (1739-1803). Auteur du texte","","Pissot (Paris)","1780","","","fre | français | ","71 p. ; in-8","71 p.","https://gallica.bnf.fr/ark:/12148/bpt6k61123523"
"446","http://catalogue.bnf.fr/ark:/12148/cb307199202","monographie","texte imprimé","Nouveau supplément au Cours de littérature de M. de La Harpe . Contenant 1° l'éloge de Voltaire ; 2° la réfutation des lettres de feu M. Ginguené sur les Confessions de J.-J. Rousseau ; 3° la réfutation des principes de J.-J. Rousseau sur la souveraineté nationale ; 4° la lettre de M. Sélis... sur le Collège de France avec la réponse de M. de La Harpe... 5° l'examen de plusieurs assertions hasardées par M. de La Harpe, dans sa philosophie du XVIIIe siècle, par M.***","La Harpe, Jean François de (1739-1803). Auteur du texte","Barbier, Antoine-Alexandre (1765-1825). Éditeur scientifique | Sélis, Nicolas-Joseph (1737-1802). Auteur de lettres | ","Delaunay (Paris)","1818","","","fre | français | ","XII-386 p. ; in-8","386 p.","https://gallica.bnf.fr/ark:/12148/bpt6k96143299"
"447","http://catalogue.bnf.fr/ark:/12148/cb34646618z","monographie","texte imprimé","Éloge de Voltaire ([Reprod.]) par M. de La Harpe,...","La Harpe, Jean François de (1739-1803). Auteur du texte","","Hachette (Paris)","1780","","","fre | français | ","2 microfiches acétate de 49 images, argentiques ; 105 x́ 148 mm","microfiche","https://gallica.bnf.fr/ark:/12148/bpt6k86449h"
"448","http://catalogue.bnf.fr/ark:/12148/cb30720071h","monographie","texte imprimé","Du fanatisme dans la langue révolutionnaire, ou De la persécution suscitée par les barbares du dix-huitième siècle, contre la religion chrétienne et ses ministres ; suivi d'un appendice sur le calendrier républicain ; par Laharpe,...","La Harpe, Jean François de (1739-1803). Auteur du texte","","Chaumerot jeune (Paris)","1821","","","fre | français | ","199 p. ; in-8","199 p.","https://gallica.bnf.fr/ark:/12148/bpt6k30439244"
"449","http://catalogue.bnf.fr/ark:/12148/cb30720078x","monographie","texte imprimé","Philosophie du dix-huitième siècle ouvrage posthume de J. F. La harpe. Nouvelle édition. Tome premier [- second]","La Harpe, Jean François de (1739-1803). Auteur du texte","","A Paris, chez Depelafol, libraire, rue des Fossés-Saint-Germain-des-Près, n° 13 ; Mame et Delaunay-Vallée, libraires, rue Guénégaud, n° 25. M. DCCC XXV.","1825","","Philosophie -- 18e siècle","fre | français | ","2 t. ([3]-449-[1] ; [3]-546 p.) ; in-8","2 t. ([3]-449-[1] ; [3]-546 p.","https://gallica.bnf.fr/ark:/12148/bpt6k202743m | https://gallica.bnf.fr/ark:/12148/bpt6k2027440"
"450","http://catalogue.bnf.fr/ark:/12148/cb37244138f","monographie","texte imprimé","Le salut public, ou La vérité dite à la Convention ([Reprod.]) par un homme libre [Laharpe]","La Harpe, Jean François de (1739-1803). Auteur du texte","","Micro Graphix","1794-1795","Collection : Les archives de la Révolution française ; 6.2.1717","","fre | français | ","1 microfiche ; 105*148 mm","microfiche","https://gallica.bnf.fr/ark:/12148/bpt6k412388"
"451","http://catalogue.bnf.fr/ark:/12148/cb30720020m","monographie","texte imprimé","Le comte de Warwick , tragédie en cinq actes et en vers ; représentée, pour la première fois, le 7 novembre 1763","La Harpe, Jean François de (1739-1803). Auteur du texte","","impr. de Michel (Brest)","1814","","","fre | français | ","XV-[1]-67 p. ; in-8","1]-67 p.","https://gallica.bnf.fr/ark:/12148/bpt6k5772649j"
