"","link","Type.de.notice","Type.de.document","Titre","Auteur","Contributeur","Editeur","Date","Description","Sujet","Langue","Format","pages","link_gallica"
"536","http://catalogue.bnf.fr/ark:/12148/cb308878369","monographie","texte imprimé","Les Déjeunés du village, ou les Aventures de l'innocence, par M. Marmontel, pour faire suite à La Veillée du même auteur","Marmontel, Jean-François (1723-1799). Auteur du texte","","J.-A. Latour (Liége)","1791","","","fre | français | ","In-12, 99 p.","12, 99 p.","https://gallica.bnf.fr/ark:/12148/bpt6k5842704q"
"537","http://catalogue.bnf.fr/ark:/12148/cb30887937x","monographie","texte imprimé","Les Incas, ou la Destruction de l'empire du Pérou, par M. Marmontel","Marmontel, Jean-François (1723-1799). Auteur du texte","","J. Bossange et Tenon (Paris)","1821","","","fre | français | ","2 vol. in-32, frontisp. gravés","2 vol. in-32, frontisp.","https://gallica.bnf.fr/ark:/12148/bpt6k148924b"
"538","http://catalogue.bnf.fr/ark:/12148/cb308878845","monographie","texte imprimé","La neuvaine de Cythère / par Marmontel,... ; avec notice par M. Charles Monselet","Marmontel, Jean-François (1723-1799). Auteur du texte","Monselet, Charles (1825-1888). Rédaction d'une notice descriptive","A. Barraud (Paris)","1879","","","fre | français | ","1 vol. (XII-158 p.) : portrait par Cochin, vignettes ; in-4","1 vol. (XII-158 p.","https://gallica.bnf.fr/ark:/12148/bpt6k64798012"
"539","http://catalogue.bnf.fr/ark:/12148/cb30887964t","monographie","texte imprimé","L'empire du Pérou, ou les Incas / par Marmontel ; édition revue par A. R.","Marmontel, Jean-François (1723-1799). Auteur du texte","","Ardant frères (Limoges)","1881","","","fre | français | ","1 vol. (240 p.) ; 23 cm","1 vol. (240 p.","https://gallica.bnf.fr/ark:/12148/bpt6k1414914s"
"540","http://catalogue.bnf.fr/ark:/12148/cb30887976t","monographie","texte imprimé","L'Ami de la maison, comédie en 3 actes et en vers, mêlée d'ariettes,... par M. Marmontel,... La musique est de M. Grétry. [Fontainebleau, 26 octobre 1771, et Théâtre de la Comédie italienne, 24 mai 1772.]","Marmontel, Jean-François (1723-1799). Auteur du texte","","Vente (Paris)","1823","","","fre | français | ","In-8° , 42 p.","8° , 42 p.","https://gallica.bnf.fr/ark:/12148/bpt6k5808112z"
"541","http://catalogue.bnf.fr/ark:/12148/cb44911118c","monographie","texte imprimé","Polymnie. Poème posthume de Marmontel","Marmontel, Jean-François (1723-1799). Auteur du texte","","Guillaume et Cie (Paris)","1818","","","fre | français | ","In-16, XX-180 p.","16, XX-180 p.","https://gallica.bnf.fr/ark:/12148/btv1b10072097c"
"542","http://catalogue.bnf.fr/ark:/12148/cb30888064k","monographie","texte imprimé","Le peuple et le Sénat, traités comme ils le méritent , par Marmontel...","Marmontel, Jean-François (1723-1799). Auteur du texte","Luques (17..-18..?). Éditeur scientifique | Kamerlinck. Éditeur scientifique | ","([Paris.] De l'imprimerie de Ramet, rue de la Coutellerie, n° 27. [1797.])","1797","","France -- 1795-1799 (Directoire)","fre | français | ","16 p. ; in-8","16 p.","https://gallica.bnf.fr/ark:/12148/bpt6k62593190"
"543","http://catalogue.bnf.fr/ark:/12148/cb37228464c","monographie","texte imprimé","Mémoires de Marmontel ([Reprod. en fac-sim.]) publ. avec préf., notes et tables [par] Maurice Tourneux","Marmontel, Jean-François (1723-1799). Auteur du texte","Tourneux, Maurice (1849-1917). Éditeur scientifique","Slatkine reprints (Genève)","1891","","Marmontel, Jean-François (1723-1799)","fre | français | ","3 vol. (XXV-297, 378, 377 p.) ; 19 cm","3 vol. (XXV-297, 378, 377 p.","https://gallica.bnf.fr/ark:/12148/bpt6k8301n | https://gallica.bnf.fr/ark:/12148/bpt6k8302z | https://gallica.bnf.fr/ark:/12148/bpt6k83038"
"544","http://catalogue.bnf.fr/ark:/12148/cb308879326","monographie","texte imprimé","Les Incas, ou La destruction de l'empire du Pérou , par M. Marmontel","Marmontel, Jean-François (1723-1799). Auteur du texte","","Mme Buynand (Lyon)","1810","","","fre | français | ","3 vol. (XXXVI-211, 248, 244 p.) ; in-12","3 vol. (XXXVI-211, 248, 244 p.","https://gallica.bnf.fr/ark:/12148/bpt6k61529528 | https://gallica.bnf.fr/ark:/12148/bpt6k63659482 | https://gallica.bnf.fr/ark:/12148/bpt6k6392645p"
"545","http://catalogue.bnf.fr/ark:/12148/cb308879624","monographie","texte imprimé","Les Incas, ou la Destruction de l'empire du Pérou (6e édition revue par une socièté d'ecclésiastiques) par Marmontel","Marmontel, Jean-François (1723-1799). Auteur du texte","","A. Mame (Tours)","1851","Collection : Bibliothèque de la jeunesse chrétienne","","fre | français | ","1 vol. (248 p.) ; in-12","1 vol. (248 p.","https://gallica.bnf.fr/ark:/12148/bpt6k5628925d"
"546","http://catalogue.bnf.fr/ark:/12148/cb30888015c","monographie","texte imprimé","La Guirlande, ou les Fleurs enchantées, acte de ballet [paroles de M. Marmontel, musique de M. Rameau], représenté pour la première fois par l'Académie royale de musique à la suite des Indes galantes, le... 21 septembre 1751","Marmontel, Jean-François (1723-1799). Auteur du texte","","impr. de Vve Delormel et fils (Paris)","1751","","","fre | français | ","In-4° , 23 p.","4° , 23 p.","https://gallica.bnf.fr/ark:/12148/bpt6k1520331h"
"547","http://catalogue.bnf.fr/ark:/12148/cb30887975g","monographie","texte imprimé","L'Ami de la maison, comédie en 3 actes et en vers, mêlée d'ariettes,... par M. Marmontel,... La musique est de M. Grétry. [Fontainebleau, 26 octobre 1771, et Théâtre de la Comédie italienne, 24 mai 1772.]","Marmontel, Jean-François (1723-1799). Auteur du texte","","Impr. royale (Parme)","1780","","","fre | français | ","In-8° , 51 p.","8° , 51 p.","https://gallica.bnf.fr/ark:/12148/bpt6k5808044k"
"548","http://catalogue.bnf.fr/ark:/12148/cb30887823z","monographie","texte imprimé","Nouveaux contes moraux , par M. Marmontel,...","Marmontel, Jean-François (1723-1799). Auteur du texte","","J. Merlin (Paris)","1765","","","fre | français | ","256 p. ; in-12","256 p.","https://gallica.bnf.fr/ark:/12148/bpt6k6514530s"
"549","http://catalogue.bnf.fr/ark:/12148/cb30887886v","monographie","texte imprimé","Vers sur la maladie et la convalescence de Monseigneur le Dauphin . Par M. Marmontel","Marmontel, Jean-François (1723-1799). Auteur du texte","","A Paris, chez Sebastien Jorry, imprimeur libraire, quay des Augustins, aux Cigognes. M. DCC. LII. Avec approbation et permission","1752","","","fre | français | ","21-[1 bl.] p. ; in-4","21-[1 bl.] p.","https://gallica.bnf.fr/ark:/12148/bpt6k5414637k"
"550","http://catalogue.bnf.fr/ark:/12148/cb30887811z","monographie","texte imprimé","Contes moraux , par M. Marmontel,...","Marmontel, Jean-François (1723-1799). Auteur du texte","","J. Merlin (Paris)","1775","","","fre | français | ","3 vol. (XVIII-345, 376, 312 p.) : pl. gravées d'après Gravelot ; in-12","3 vol. (XVIII-345, 376, 312 p.","https://gallica.bnf.fr/ark:/12148/bpt6k1510286v | https://gallica.bnf.fr/ark:/12148/bpt6k1510288p | https://gallica.bnf.fr/ark:/12148/bpt6k1510290r"
"551","http://catalogue.bnf.fr/ark:/12148/cb30887801n","monographie","texte imprimé","Contes moraux , par M. Marmontel ; suivis d'une Apologie du théâtre","Marmontel, Jean-François (1723-1799). Auteur du texte","","[s.n.] (La Haye)","1761","","","fre | français | ","2 vol. (XIV-360, 389 p.) : fig. gravée aux titres ; in-12","2 vol. (XIV-360, 389 p.","https://gallica.bnf.fr/ark:/12148/bpt6k6516295q | https://gallica.bnf.fr/ark:/12148/bpt6k6522983z"
"552","http://catalogue.bnf.fr/ark:/12148/cb372412338","monographie","texte imprimé","La voix des pauvres, épître au roi, sur l'incendie de l'Hôtel-Dieu ([Reprod.]) par M. Marmontel,...","Marmontel, Jean-François (1723-1799). Auteur du texte","","Micro Graphix","1773","Collection : Les archives de la Révolution française ; 9.5.10","Hôpitaux -- Paris (France)","fre | français | ","1 microfiche ; 105*148 mm","microfiche","https://gallica.bnf.fr/ark:/12148/bpt6k42941b"
"553","http://catalogue.bnf.fr/ark:/12148/cb308879833","monographie","texte imprimé","Antigone, opéra lyrique en 3 actes. [Paroles de Marmontel, musique de Zingarelli.] [Paris, Théâtre de l'Académie royale de musique, 30 avril 1790.]","Marmontel, Jean-François (1723-1799). Auteur du texte","","impr. de P. de Lormel (Paris)","1790","","","fre | français | ","In-4° , VI-47 p.","4° , VI-47 p.","https://gallica.bnf.fr/ark:/12148/bpt6k1512151x"
"554","http://catalogue.bnf.fr/ark:/12148/cb308879953","monographie","texte imprimé","Cléopâtre , tragédie par M. Marmontel","Marmontel, Jean-François (1723-1799). Auteur du texte","","S. Jorry (Paris)","1750","","","fre | français | ","VIII-87 p. ; in-12","87 p.","https://gallica.bnf.fr/ark:/12148/bpt6k5772338q"
"555","http://catalogue.bnf.fr/ark:/12148/cb308880350","monographie","texte imprimé","Les Sibarites, acte de ballet [paroles de M. Marmontel, musique de M. Rameau]... [Fontainebleau le 13 novembre 1753 ; et Paris, Académie royale de musique, 12 juillet 1757.]","Marmontel, Jean-François (1723-1799). Auteur du texte","","impr. de Vve Delormel et fils (Paris)","1757","","","fre | français | ","In-4° , 14 p.","4° , 14 p.","https://gallica.bnf.fr/ark:/12148/bpt6k312877x"
"556","http://catalogue.bnf.fr/ark:/12148/cb30887984f","monographie","texte imprimé","Aristomène, tragédie, par M. Marmontel. [Comédiens ordinaires du Roy, 30 avril 1749]","Marmontel, Jean-François (1723-1799). Auteur du texte","","S. Jorry (Paris)","1750","","","fre | français | ","152 p. ; in-12","152 p.","https://gallica.bnf.fr/ark:/12148/bpt6k5819751q"
"557","http://catalogue.bnf.fr/ark:/12148/cb308878082","monographie","texte imprimé","Contes moraux , par M. Marmontel,...","Marmontel, Jean-François (1723-1799). Auteur du texte","Gravelot (1699-1773). Illustrateur","J. Merlin (Paris)","1765","","","fre | français | ","3 vol. (XVI-345, 376, 312 p.) : pl. et titres gravés d'après Gravelot ; in-12","3 vol. (XVI-345, 376, 312 p.","https://gallica.bnf.fr/ark:/12148/bpt6k6511246p | https://gallica.bnf.fr/ark:/12148/bpt6k6521489d | https://gallica.bnf.fr/ark:/12148/bpt6k65142849"
"558","http://catalogue.bnf.fr/ark:/12148/cb30887895t","monographie","texte imprimé","Bélisaire . Par M. Marmontel,...","Marmontel, Jean-François (1723-1799). Auteur du texte","Gravelot (1699-1773). Illustrateur","Merlin (Paris)","1767","","","fre | français | ","X-340-[6] p. : fig. de Gravelot ; in-8","340-[6] p.","https://gallica.bnf.fr/ark:/12148/bpt6k96921511"
"559","http://catalogue.bnf.fr/ark:/12148/cb41890221c","monographie","texte imprimé","Pénélope, tragédie-lyrique en trois actes ; représentée pour la premiere fois, devant Leurs Majestés, a Fontainebleau, le 2 novembre 1785, et a Paris, sur le théatre de l'Académie royale de musique, le 6 mardi décembre de la même année","Marmontel, Jean-François (1723-1799). Auteur du texte","Piccinni, Niccolò (1728-1800). Compositeur","A Paris, de l'imprimerie de P. de Lormel, imprimeur de ladite Académie, rue du Foin Saint-Jacques, à l'Image de Sainte Genevieve. On trouvera des exemplaiures à la salle de l'Opéra. M. DCC. LXXXV. Avec approbation, & privilege du Roi","1785","","","fre | français | ","59 p. ; in-4","59 p.","https://gallica.bnf.fr/ark:/12148/bpt6k1512986w"
"560","http://catalogue.bnf.fr/ark:/12148/cb308880052","monographie","texte imprimé","Le dormeur éveillé , opéra-comique, en quatre actes, en vers, mêlé d'ariettes. Représenté devant LL. MM. à Fontainebleau","Marmontel, Jean-François (1723-1799). Auteur du texte","","impr. de P.-R.-C. Ballard (Paris)","1783","","","fre | français | ","2-88 p. ; in-8","2-88 p.","https://gallica.bnf.fr/ark:/12148/bpt6k58180970"
"561","http://catalogue.bnf.fr/ark:/12148/cb30888034n","monographie","texte imprimé","Les Sibarites : acte de ballet, représenté devant le Roi à Fontainebleau le 13 novembre 1753 / [paroles de J.-F. Marmontel] ; musique de Rameau]","Marmontel, Jean-François (1723-1799). Auteur du texte","","impr. de Ballard ((Paris,))","1753","","","fre | français | ","In-4° , 19 p.","4° , 19 p.","https://gallica.bnf.fr/ark:/12148/bpt6k1521997n"
"562","http://catalogue.bnf.fr/ark:/12148/cb30887870g","monographie","texte imprimé","Mémoires / de Marmontel ; précédés d'une introduction par M. Fs. Barrière","Marmontel, Jean-François (1723-1799). Auteur du texte","Barrière, François (1786-1868). Préfacier","Firmin Didot frères (Paris)","1846","Collection : Bibliothèque des mémoires relatifs à l'histoire de France, pendant le 18e siècle ; 5","","fre | français | ","1 vol. (XI-446 p.) ; in-16","1 vol. (XI-446 p.","https://gallica.bnf.fr/ark:/12148/bpt6k6241762m"
"563","http://catalogue.bnf.fr/ark:/12148/cb30887981d","monographie","texte imprimé","Annette et Lubin , pastorale, mise en vers par M. Marmontel, & en musique par M. de La Borde","Marmontel, Jean-François (1723-1799). Auteur du texte","La Borde, Jean-Benjamin de (1734-1794). Compositeur","Lesclapart (Paris)","1762","","","fre | français | ","52 p.-28 p. de musique ; in-8","52 p.","https://gallica.bnf.fr/ark:/12148/bpt6k5809424h"
"564","http://catalogue.bnf.fr/ark:/12148/cb44288625z","monographie","partition musicale","De M.r de Marmontel","Marmontel, Jean-François (1723-1799). Compositeur","","","1750-1780","Ancien possesseur : Trinquand (famille). Ancien possesseur | Comprend : Pour la Mantoline [i.e. mandoline] | ","","","2 f. ; 20 x 25,5 cm",NA,"https://gallica.bnf.fr/ark:/12148/btv1b52514706c"
"565","http://catalogue.bnf.fr/ark:/12148/cb30887952t","monographie","texte imprimé","Les Incas, ou La destruction de l'empire du Pérou / par M. Marmontel","Marmontel, Jean-François (1723-1799). Auteur du texte","","Librairie de la bibliothèque nationale (Paris)","1895","Collection : Bibliothèque nationale ; 202-203","","fre | français | ","2 vol. (191, 192 p.) ; in-32","2 vol. (191, 192 p.","https://gallica.bnf.fr/ark:/12148/bpt6k64554g | https://gallica.bnf.fr/ark:/12148/bpt6k64555t"
"566","http://catalogue.bnf.fr/ark:/12148/cb32421111x","monographie","texte imprimé","Didon , tragédie lyrique en trois actes, représentée a Fontainebleau devant Leurs Majestés, le 16 octobre 1783, et pour la premiere fois, sur le théâtre de l'Académie-royale de musique, le lundi 1er décembre 1783.","Marmontel, Jean-François (1723-1799). Auteur du texte","Piccinni, Niccolò (1728-1800). Compositeur","A Paris, de l'imprimerie de P. de Lormel, imprimeur de ladite Académie, rue du Foin Saint-Jacques, à l'image de Sainte Genevieve. On trouvera des exemplaires à la salle de l'Opéra. M. DCC. LXXXIII. Avec approbation, et privilege du Roi.","1783","","","fre | français | ","VIII-51-[1] p. ; in-4","51-[1] p.","https://gallica.bnf.fr/ark:/12148/bpt6k72308g"
"567","http://catalogue.bnf.fr/ark:/12148/cb34025000j","monographie","texte imprimé","Mémoires de Marmontel / publ. avec préf., notes et tables, par Maurice Tourneux","Marmontel, Jean-François (1723-1799). Auteur du texte","Tourneux, Maurice (1849-1917). Éditeur scientifique","Librairie des bibliophiles (Paris)","1891","Collection : Bibliothèque des mémoires","France (1715-1774, Louis XV)","fre | français | ","3 vol. ; in-16",NA,"https://gallica.bnf.fr/ark:/12148/bpt6k2135848 | https://gallica.bnf.fr/ark:/12148/bpt6k213585n | https://gallica.bnf.fr/ark:/12148/bpt6k2135861"
"568","http://catalogue.bnf.fr/ark:/12148/cb308879744","monographie","texte imprimé","L'Ami de la maison","Marmontel, Jean-François (1723-1799). Auteur du texte","Grétry, André-Ernest-Modeste (1741-1813). Auteur ou responsable intellectuel","Vente (Paris)","1772","","","fre | français | ","In-8, XII-60 p., et 7 p. de musique","8, XII-60 p.","https://gallica.bnf.fr/ark:/12148/bpt6k58076376"
"569","http://catalogue.bnf.fr/ark:/12148/cb308878547","monographie","texte imprimé","Essai sur les révolutions de la musique, en France.","Marmontel, Jean-François (1723-1799). Auteur du texte","","","1777","","","fre | français | ","38 p. ; in-8","38 p.","https://gallica.bnf.fr/ark:/12148/bpt6k62759735"
"570","http://catalogue.bnf.fr/ark:/12148/cb308880339","monographie","texte imprimé","Pénélope , tragédie lyrique en 3 actes, représentée devant LL. MM., à Fontainebleau, le 2 novembre 1785","Marmontel, Jean-François (1723-1799). Auteur du texte","Piccinni, Niccolò (1728-1800). Compositeur","impr. de P.-R.-C. Ballard (Paris)","1785","","","fre | français | ","IV-56 p. : ill. ; in-8","56 p.","https://gallica.bnf.fr/ark:/12148/bpt6k73985t"
"571","http://catalogue.bnf.fr/ark:/12148/cb30887988t","monographie","texte imprimé","La bergère des Alpes , pastorale en trois actes et en vers, mêlée de chants, par M. Marmontel de l'Académie françoise","Marmontel, Jean-François (1723-1799). Auteur du texte","Kohaut, Josef (1734-1777). Compositeur","A Paris, chez Merlin, libraire, rue de la Harpe, vis-à-vis la rue Poppée","1766","","","fre | français | ","56-4 p. : 4 p. de musique, frontisp. gravé d'après Gravelot ; in-8, in-12","56-4 p.","https://gallica.bnf.fr/ark:/12148/bpt6k5813318v"
"572","http://catalogue.bnf.fr/ark:/12148/cb30887973s","monographie","texte imprimé","L'ami de la maison, comédie en trois actes et en vers, mêlée d'ariettes ; représentée, devant sa majesté, à Fontainebleau, le 26 octobre 1771","Marmontel, Jean-François (1723-1799). Auteur du texte","","P.-R.-C. Ballard (Paris)","1771","","","fre | français | ","61 p. ; in-8","61 p.","https://gallica.bnf.fr/ark:/12148/bpt6k5695678h"
"573","http://catalogue.bnf.fr/ark:/12148/cb30887991q","monographie","texte imprimé","Céphale et Procris , ballet-héroique, représenté pour la première fois par l'Académie royale de musique, le 2 mai 1775. Et remis au théâtre, le 29 avril 1777.","Marmontel, Jean-François (1723-1799). Auteur du texte","Grétry, André-Ernest-Modeste (1741-1813). Compositeur","A Paris, chés de Lormel, imprimeur de ladite Académie, rue du Foin, à l'Image Sainte Genevieve. On trouvera des exemplaires du poeme à la salle de l'Opera. M. DCC. LXXVII. Avec approbation et privilege du Roi.","1777","","","fre | français | ","64 p. ; in-4","64 p.","https://gallica.bnf.fr/ark:/12148/bpt6k1514075m"
"574","http://catalogue.bnf.fr/ark:/12148/cb30887990c","monographie","texte imprimé","Céphale et Procris, ballet-héroïque. [Paroles de M. Marmontel, musique de M. Grétry.] [Paris, Académie royale de musique, 2 mai 1775]","Marmontel, Jean-François (1723-1799). Auteur du texte","","impr. de Delormel (Paris)","1775","","","fre | français | ","In-4° , 68 p.","4° , 68 p.","https://gallica.bnf.fr/ark:/12148/bpt6k1322159 | https://gallica.bnf.fr/ark:/12148/bpt6k1514077f"
"575","http://catalogue.bnf.fr/ark:/12148/cb30888019r","monographie","texte imprimé","Hercule mourant , tragédie lyrique, représentée pour la premiere fois, par l'Academie-royale de musique, le vendredi 3 avril 1761","Marmontel, Jean-François (1723-1799). Auteur du texte","Dauvergne, Antoine (1713-1797). Compositeur","Aux dépens de l'Académie. A Paris, chés de Lormel, imprimeur de ladite Académie, rue du Foin, à l'image Sainte Genevieve. On trouvera les livres de paroles à la salle de l'Opera. M. DCC. LXI. Avec approbation et privilege du Roi","1761","","","fre | français | ","54 p. ; in-4","54 p.","https://gallica.bnf.fr/ark:/12148/bpt6k1520389q"
"576","http://catalogue.bnf.fr/ark:/12148/cb30887809d","monographie","texte imprimé","Contes moraux , par M. Marmontel,...","Marmontel, Jean-François (1723-1799). Auteur du texte","Gravelot (1699-1773). Dessinateur du modèle | Cochin, Charles-Nicolas (1715-1790). Dessinateur du modèle | Saint-Aubin, Augustin de (1736-1807). Graveur | ","A Paris, chez J. Merlin libraire, rue de la Harpe. M. DCC. LXV","1765","","","fre | français | ","3 vol. (XVI-[2]-345 p.-[9] f. de pl., [4]-376 p.-[9] f. de pl., [8]-312 p.-[5] f. de pl.) ; in-8","3 vol. (XVI-[2]-345 p.","https://gallica.bnf.fr/ark:/12148/bpt6k1051592t | https://gallica.bnf.fr/ark:/12148/bpt6k1051594n | https://gallica.bnf.fr/ark:/12148/bpt6k1051596g | https://gallica.bnf.fr/ark:/12148/bpt6k6344836n | https://gallica.bnf.fr/ark:/12148/bpt6k1262652q | https://gallica.bnf.fr/ark:/12148/bpt6k1263806g"
"577","http://catalogue.bnf.fr/ark:/12148/cb308880141","monographie","texte imprimé","La guirlande, ou Les fleurs enchantées, acte de ballet [paroles de M. Marmontel, musique de M. Rameau], représenté pour la première fois par l'Académie royale de musique à la suite des Indes galantes, le mardy 21 septembre 1751","Marmontel, Jean-François (1723-1799). Auteur du texte","","impr. de Vve Delormel et fils (Paris)","1751","","","fre | français | ","In-4° , 23 p.","4° , 23 p.","https://gallica.bnf.fr/ark:/12148/bpt6k5469341c | https://gallica.bnf.fr/ark:/12148/bpt6k5472527w | https://gallica.bnf.fr/ark:/12148/bpt6k6335719t | https://gallica.bnf.fr/ark:/12148/bpt6k6335718d"
"578","http://catalogue.bnf.fr/ark:/12148/cb30887795j","monographie","texte imprimé","Oeuvres posthumes de Marmontel ... imprimées sur le manuscrit autographe de l'auteur","Marmontel, Jean-François (1723-1799). Auteur du texte","","Xhrouet (Paris) | Déterville (Paris) | Lenormant [etc.] (Paris) | ","1804-1806","Comprend : I-IV. Mémoires ; V-VI. Régence du duc d'Orléans ; VII. Logique ; VIII. Métaphysique ; IX. Morale ; X. Grammaire ; XI. Mélanges","","fre | français | ","11 vol. ; in-8",NA,"https://gallica.bnf.fr/ark:/12148/bpt6k65540587 | https://gallica.bnf.fr/ark:/12148/bpt6k6554056d | https://gallica.bnf.fr/ark:/12148/bpt6k6554059n | https://gallica.bnf.fr/ark:/12148/bpt6k6554064z | https://gallica.bnf.fr/ark:/12148/bpt6k6554090f | https://gallica.bnf.fr/ark:/12148/bpt6k65540609 | https://gallica.bnf.fr/ark:/12148/bpt6k6554363k | https://gallica.bnf.fr/ark:/12148/bpt6k65540372 | https://gallica.bnf.fr/ark:/12148/bpt6k6555340w | https://gallica.bnf.fr/ark:/12148/bpt6k65543625 | https://gallica.bnf.fr/ark:/12148/bpt6k6555510f"
"579","http://catalogue.bnf.fr/ark:/12148/cb351116230","monographie","texte imprimé","Oeuvres complètes ([Reproduction en fac-similé]) Marmontel ; [par Villenave]","Marmontel, Jean-François (1723-1799). Auteur du texte","Villenave, Mathieu-Guillaume-Thérèse (1762-1846). Éditeur scientifique","Slatkine reprints (Genève)","1819-1820","Comprend : Tome I : Mémoires ; Régence du duc d'Orléans ; Tome II : Contes moraux ; Nouveaux contes moraux ; Tome III : Nouveaux contes moraux ; Bélisaire ; Les Incas ; Tome IV : Essai sur le goût ; Elemens de littérature ; Tome V : Elemens de littérature ; Tragédies, opéras, comédies ; Tome VI : Grammaire , Logique ; Métaphysique ; Morale ; La pharsale de Lucain ; Tome VII : Mélange de prose et de poésie ; Mélanges nouvellement recueillis","","fre | français | ","7 vol. (XLIII-784, 621, 596, 873, 798, 751, 880 p.) ; 23 cm","7 vol. (XLIII-784, 621, 596, 873, 798, 751, 880 p.","https://gallica.bnf.fr/ark:/12148/bpt6k8304k | https://gallica.bnf.fr/ark:/12148/bpt6k8305w | https://gallica.bnf.fr/ark:/12148/bpt6k83066 | https://gallica.bnf.fr/ark:/12148/bpt6k8307h | https://gallica.bnf.fr/ark:/12148/bpt6k8308t | https://gallica.bnf.fr/ark:/12148/bpt6k83094 | https://gallica.bnf.fr/ark:/12148/bpt6k8310m"
"580","http://catalogue.bnf.fr/ark:/12148/cb30887972f","monographie","texte imprimé","Acanthe et Cephise, ou La sympatie , pastorale héroïque, a l'occasion de la naissance de Monseigneur le duc de Bourgogne, représentée pour la premiere fois par l'Académie royale de musique, le jeudy 18 novembre 1751.","Marmontel, Jean-François (1723-1799). Auteur du texte","","Aux dépens de l'Académie. A Paris, chez la V. Delormel & fils, imprimeur de ladite Académie, rue du Foin, à l'Image Ste. Geneviéve. On trouvera des livres de paroles à la salle de l'Opéra. M.DCC.LI. Avec approbation et privilege du Roy.","1751","","","fre | français | ","58-[1] p. ; in-4","58-[1] p.","https://gallica.bnf.fr/ark:/12148/bpt6k132214x | https://gallica.bnf.fr/ark:/12148/bpt6k15111239"
"581","http://catalogue.bnf.fr/ark:/12148/cb30887859z","monographie","texte imprimé","Poétique françoise , par M. Marmontel","Marmontel, Jean-François (1723-1799). Auteur du texte","Cochin, Charles-Nicolas (1715-1790). Graveur","Lesclapart (Paris)","1763","","Poétique -- 18e siècle","fre | français | ","2 vol. : front. gr. par Cochin ; in-8",NA,"https://gallica.bnf.fr/ark:/12148/bpt6k50772s | https://gallica.bnf.fr/ark:/12148/bpt6k1092110"
"582","http://catalogue.bnf.fr/ark:/12148/cb30887930h","monographie","texte imprimé","Les Incas, ou La destruction de l'empire du Pérou ; par M. Marmontel,... Tome premier [-second]","Marmontel, Jean-François (1723-1799). Auteur du texte","Moreau, Jean-Michel (1741-1814). Illustrateur | Duclos, Antoine-Jean (1742-1795). Graveur | De Ghendt, Emmanuel Jean Népomucène (1738?-1815). Graveur | Helman, Isidore-Stanislas (1743-1806?). Graveur | Launay, Nicolas de (1739-1792). Graveur | Le Veau, Jean-Jacques (1729-1786). Graveur | Simonet, Jean-Baptiste-Blaise (1742-1813?). Graveur | Née, François Denis (1732-1817). Graveur | ","A Paris, chez Lacombe, libraire, rue de Tournon, près le Luxembourg. M. DCC. LXXVII. Avec approbation, et privilege du Roi.","1777","","","fre | français | ","2 t. (XII-338-[1] p., [6] f. de pl. (dont 1 front.) ; [4]-380-[4] p., [5] f. de pl.) ; in-8","2 t. (XII-338-[1] p.","https://gallica.bnf.fr/ark:/12148/bpt6k10515989 | https://gallica.bnf.fr/ark:/12148/bpt6k1051600x | https://gallica.bnf.fr/ark:/12148/bpt6k5509717p | https://gallica.bnf.fr/ark:/12148/bpt6k55305638"
